LIB_ID,SGD_DB_ID,SYS_ID,GENE_SYM,NAME,PHENOTYPE,DESCRIPTION
AAR2,S000000170,YBL074C,AAR2,A1-Alpha2 Repression,"Essential gene; conditional mutant is heat sensitive, loses viability at elevated temperature and displays elevated colony sectoring, indicative of chromosome instability; reduction of function mutant has increased telomere length, and decreased competitive fitness in minimal medium
",Component of the U5 snRNP complex; required for splicing of U3 precursors; originally described as a splicing factor specifically required for splicing pre-mRNA of the MATa1 cistron
AAT1,S000001589,YKL106W,AAT1,Aspartate AminoTransferase,"Non-essential gene; null mutant has a reduced respiratory growth rate and decreased competitive fitness on non-fermentable carbon sources; null has reduced groth on minimal medium and a reduced ability to use proline as a nitrogen source; null mutant has a reduction in caloric restriction-mediated lifespan extension, while overexpression enhances both chronological and replicative lifespan; overexpression increases silencing at the rDNA locus; null mutant has enhanced biofilm formation; heterozygous null mutant is haploinsufficient
",Mitochondrial aspartate aminotransferase; catalyzes the conversion of oxaloacetate to aspartate in aspartate and asparagine biosynthesis
AAT2,S000004017,YLR027C,AAT2,Aspartate AminoTransferase,"Non-essential gene in S288C, but essential in the Sigma1278b background; S288C null mutant displays a decreased growth rate and decreased competitive fitness in rich medium, temperature sensitivity, and a decreased respiratory growth rate; null mutant is sensitive to DNA synthesis inhibitors, DNA damaging agents and topoisomerase inhibitors; null mutant has decreased resistance to hyperosmotic stress, metals, and zymolyase; null mutant displays decreased chronological lifespan; homozygous null mutant has decreased sporulation efficiency
",Cytosolic aspartate aminotransferase involved in nitrogen metabolism; localizes to peroxisomes in oleate-grown cells
ABD1,S000000440,YBR236C,ABD1,,"Essential gene; temperature-sensitive mutation causes decreasing protein synthesis upon temperature shift; repression leads to abnormal protein secretion
",Methyltransferase; catalyzes the transfer of a methyl group from S-adenosylmethionine to the GpppN terminus of capped mRNA; nuclear protein that relocalizes to the cytosol in response to hypoxia
ABF1,S000001595,YKL112W,ABF1,ARS-Binding Factor 1,"Essential gene; overexpression variously reported to cause sensitivity to nocodazol, decreased growth rate, or lethality; conditional mutants show delayed progression through G2 phase
","DNA binding protein with possible chromatin-reorganizing activity; involved in transcriptional activation, gene silencing, and DNA replication and repair"
ABF2,S000004676,YMR072W,ABF2,ARS-Binding Factor,"Non-essential gene; null mutant is incapable of respiratory growth, sensitive to hyperosmotic stress, and shows defects in mitochondrial genome maintenance; overexpression causes abnormal budding and cell cycle progression through G2 phase
","Mitochondrial DNA-binding protein; involved in mitochondrial DNA replication and recombination, member of HMG1 DNA-binding protein family; activity may be regulated by protein kinase A phosphorylation; ABF2 has a paralog, IXR1, that arose from the whole genome duplication; human homolog TFAM can complement yeast abf2 mutant, rescuing the loss-of-mitochondrial DNA phenotype in a yeast abf2 strain"
ACC1,S000005299,YNR016C,ACC1,Acetyl-CoA Carboxylase,"Essential gene; conditional mutants accumulate poly(A) RNA in the nucleus; overexpression leads to increased lipid accumulation; reduction of function results in chromosome instability, decreased competitive fitness, heat sensitivity
","Acetyl-CoA carboxylase, biotin containing enzyme; catalyzes carboxylation of cytosolic acetyl-CoA to form malonyl-CoA and regulates histone acetylation by regulating the availablity of acetyl-CoA; required for de novo biosynthesis of long-chain fatty acids; ACC1 has a paralog, HFA1, that arose from the whole genome duplication"
ACO1,S000004295,YLR304C,ACO1,ACOnitase,"Non-essential gene; null mutant shows glutamate auxotrophy, sensitivity to hyperosmotic stress, increased accumulation of iron in the mitochondria, loss of mitochondrial genome and deficiency in respiratory growth
",Aconitase; required for the tricarboxylic acid (TCA) cycle and also independently required for mitochondrial genome maintenance; component of the mitochondrial nucleoid; mutation leads to glutamate auxotrophy; human homolog ACO2 can complement yeast null mutant
ACP1,S000001675,YKL192C,ACP1,Acyl Carrier Protein,"Essential gene in S288C, but non-essential in another background; S288C-derived null mutant is viable but slow growing when cultured anaerobically; non-essential null mutant is petite and displays decreased accumulation of lipoic acid; reduction of function mutant displays decreased competitive fitness in minimal medium, chromosomal instability, and decreased resistance to hydroxyurea and MMS; overexpression results in increased resistance to dihydromotuporamine C, a tumor cell invasion inhibitor; heterozygous null mutant is haploinsufficient
","Mitochondrial matrix acyl carrier protein; involved in biosynthesis of octanoate, which is a precursor to lipoic acid; activated by phosphopantetheinylation catalyzed by Ppt2p"
ACS2,S000004143,YLR153C,ACS2,Acetyl CoA Synthetase,"Non-essential gene; null mutant is capable of respiratory growth on non-fermentable carbon sources, but incapable of fermentative growth on glucose as a carbon source
","Acetyl-coA synthetase isoform; along with Acs1p, acetyl-coA synthetase isoform is the nuclear source of acetyl-coA for histone acetylation; mutants affect global transcription; required for growth on glucose; expressed under anaerobic conditions"
ACT1,S000001855,YFL039C,ACT1,ACTin,"Essential gene; conditional mutants show pleiotropic defects including abnormal actin cytoskeleton, chromosome instability, altered subcellular morphology, increased sensitivity to heat, multiple chemicals and osmotic stress; overexpression leads to growth arrest
","Actin; structural protein involved in cell polarization, endocytosis, and other cytoskeletal functions"
ADA2,S000002856,YDR448W,ADA2,transcriptional ADAptor,"Non-essential gene; null mutant shows altered transcription of multiple genes, weakened cell wall and decreased growth rate; in systematic studies null mutant shows inositol auxotrophy, increased sensitivity to multiple chemicals, alkaline pH and heat
",Transcription coactivator; component of the ADA and SAGA transcriptional adaptor/HAT (histone acetyltransferase) complexes
ADE13,S000004351,YLR359W,ADE13,ADEnine requiring,Essential gene in S288C; reduction-of-function mutations result in adenine auxotrophy,Adenylosuccinate lyase; catalyzes two steps in the 'de novo' purine nucleotide biosynthetic pathway; expression is repressed by adenine and activated by Bas1p and Pho2p; mutations in human ortholog ADSL cause adenylosuccinase deficiency; human ADSL can complement yeast ADE13 null mutant
ADE2,S000005654,YOR128C,ADE2,ADEnine requiring,"Non-essential gene; null mutant displays adenine auxotrophy, forms red colonies and is sensitive to purine analogs; in large-scale studies null mutant shows decreased competitive fitness and shortened chronological lifespan
",Phosphoribosylaminoimidazole carboxylase; catalyzes a step in the 'de novo' purine nucleotide biosynthetic pathway; red pigment accumulates in mutant cells deprived of adenine
AEP1,S000004668,YMR064W,AEP1,ATPase ExPression,"Non-essential gene; in systematic studies, null mutant is incapable of respiratory growth and grows slowly under standard fermentative growth conditions; also shows sensitivity to lipids, lower resistance to ethanol, abnormal mitochondrial morphology and decreased mitophagy; homozygous null mutation in diploids causes sensitivity to oxidative stress, but increases innate thermotolerance and resistance to benomyl, actinomycin D, Calcofluor White, idarubicin and tirapazamine
",Protein required for expression of the mitochondrial OLI1 gene; mitochondrial OLI1 gene encodes subunit 9 of F1-F0 ATP synthase
AEP2,S000004895,YMR282C,AEP2,ATPase ExPression,"Non-essential gene; null mutant is unable to grow under respiratory growth conditions; in systematic studies, null mutant shows slow growth under fermentative growth condtions, produces small-size cells, has abnormal mitochondrial morphology and lower resistance to ethanol; in diploids under competitive growth conditions, homozygous null mutation results in sensitivity to oxidative stress and increased resistance to cell wall-affecting chemicals, such as caffeine and Calcofluor White, and to DNA-damaging factors, such as MMS, idarubicin, melphalan
",Mitochondrial protein; likely involved in translation of the mitochondrial OLI1 mRNA; exhibits genetic interaction with the OLI1 mRNA 5'-untranslated leader
AEP3,S000005926,YPL005W,AEP3,ATPase ExPression,"Non-essential gene; null mutation increases frequency of mitochondrial genome loss (rho- mutations) and leads to respiratory growth defect; in systematic studies, null mutant grows slowly, produces small cells and shows strong vacuolar fragmentation; in diploids under competitive growth conditions, homozygous null mutation results in sensitivity to oxidative stress and increased resistance to cell wall-affecting chemicals, such as caffeine and Calcofluor White, and to DNA-damaging factors, such as MMS, idarubicin, melphalan
",Peripheral mitochondrial inner membrane protein; may facilitate use of unformylated tRNA-Met in mitochondrial translation initiation; stabilizes the bicistronic AAP1-ATP6 mRNA
AFG2,S000004389,YLR397C,AFG2,ATPase Family Gene,"Essential gene; repression leads to defects in nuclear export and accumulation of large ribosomal subunits in the nucleus; repression also results in opi- phenotype (overproduction and excretion of inositol in the absence of inositol and choline)
","ATPase of the CDC48/PAS1/SEC18 (AAA) family, forms a hexameric complex; is essential for pre-60S maturation and release of several preribosome maturation factors; releases Rlp24p from purified pre-60S particles in vitro; target of the ribosomal biosynthesis inhibitor diazaborine; may be involved in degradation of aberrant mRNAs"
AFG3,S000000819,YER017C,AFG3,ATPase Family Gene,"Non-essential gene; null mutant is unable to use nonfermentable carbon sources and has a lengthened replicative lifespan, although lifespan extension by caloric restriction is less than in wild type; null mutant displays increased resistance to oxidative and heat stress; null mutant accumulates decreased levels of cardiolipin in mitochondrial membranes; in large-scale studies, null mutant shows reduced competitive fitness and altered sensitivity to a variety of drugs
",Mitochondrial inner membrane m-AAA protease component; mediates degradation of misfolded or unassembled proteins; also required for correct assembly of mitochondrial enzyme complexes; involved in cytoplasmic mRNA translation and aging; expression of human homolog AFG3L2 can complement yeast yta12 afg3 double mutant
AFT1,S000003039,YGL071W,AFT1,Activator of Ferrous Transport,"Non-essential gene; null mutant displays a decreased growth rate, reduced competitive fitness and respiratory growth defects; null mutant is sensitive to metals, alkaline pH, and a variety of chemicals; null mutant displays chromosome instability, has decreased cell size and delayed progression through the G1 phase of the cell cycle; ovexpression and constitutively active alleles also display decreased growth rates
","Transcription factor involved in iron utilization and homeostasis; binds consensus site PyPuCACCCPu and activates transcription in response to changes in iron availability; in iron-replete conditions localization is regulated by Grx3p, Grx4p, and Fra2p, and promoter binding is negatively regulated via Grx3p-Grx4p binding; AFT1 has a paralog, AFT2, that arose from the whole genome duplication; relative distribution to the nucleus increases upon DNA replication stress"
AIM10,S000000889,YER087W,AIM10,Altered Inheritance rate of Mitochondria,"Non-essential gene; null mutant is heat sensitive, has a vegetative growth defect, a respiratory growth defect and displays reduced competitive fitness in various media; null mutant has a decreased ability to utilize the carbon source galactose and the nitrogen sources, glutamine and proline; null mutant displays a decreased frequency of spontaneous mitochondrial genome loss but an elevated nuclear mutation frequency; null mutant has a small cell size, decreased chronological lifespan, decreased desiccation resistance, and displays a reduction in the number of lipid particles per cell; heterozygous null mutant is haploinsufficient
",Protein with similarity to tRNA synthetases; non-tagged protein is detected in purified mitochondria; null mutant is viable and displays elevated frequency of mitochondrial genome loss
AIM11,S000002960,YER093C-A,AIM11,Altered Inheritance rate of Mitochondria,"Non-essential gene; null mutant displays decreased competitive fitness in media containing either fermentable or non-fermentable carbon sources, and a decreased rate of respiratory growth; null mutant displays an increased frequency of spontaneous mitochondrial genome loss; null mutant has decreased chronological lifespan, decreased desiccation resistance and is defective in biofilm formation; null mutant is inhibited by palmitoleic acid but stimulated by oleic acid
","Protein of unknown function; null mutant is viable but shows increased loss of mitochondrial genome and synthetic interaction with prohibitin (phb1); contains an intron; SWAT-GFP and mCherry fusion proteins localize to the mitochondria; YER093C-A has a paralog, YBL059W, that arose from the whole genome duplication"
AIM22,S000003582,YJL046W,AIM22,Altered Inheritance rate of Mitochondria,"Non-essential gene; null mutant displays decreased competitive fitness in various media, a decreased respiratory growth rate, and decreased rate of utilization of various carbon and nitrogen sources; null mutant has a reduced cell size, increased heat sensitivity, and decreased chronological lifespan; null mutant displays a reduced frequency of spontaneous mitochondrial genome loss and elevated levels of Rnr3p, indicative of genome instability; null mutant contains severely reduced lipoate levels and is unable to lipoylate several mitochondrial enzymes; null mutant has decreased resistance to oxidative stress and desiccation but increased resistance to zinc deficiency
",Putative lipoate-protein ligase; required along with Lip2 and Lip5 for lipoylation of Lat1p and Kgd2p; similar to E. coli LplA; null mutant displays reduced frequency of mitochondrial genome loss
AIM26,S000001520,YKL037W,AIM26,Altered Inheritance rate of Mitochondria,"Non-essential gene in S288C, but essential in the SK1 background; S288C null mutant has a small cell size in a saturated culture, a decreased growth rate on fermentable and nonfermentable carbon sources, decreased competitive fitness on various media, and a reduction in the ability to utilize galactose as carbon source and arginine or glutamate as nitrogen sources; null mutant displays an increased frequency of spontaneous mitochondrial genome loss and has defects in both mitophagy and autophagy; null has decreased innate thermotolerance, decreased chronological lifespan, decreased resistance to desiccation, and decreased resistance to both gliotoxin and killer toxin
",Protein of unknown function; null mutant is viable and displays elevated frequency of mitochondrial genome loss; null mutation confers sensitivity to tunicamycin and DTT
AIM44,S000006079,YPL158C,AIM44,Altered Inheritance rate of Mitochondria,"Non-essential gene; null mutant displays decreased rates of fermentative and respiratory growth, and decreased competitive fitness in various media; null mutant accumulates mother cells that retain a connection to two or more buds, displays a thin secondary septum, a reduction in the accumulation of Rho1p at the bud neck after actomyosin ring (AMR) contraction, and an abnormal reaccumulation of Cdc42p at bud neck after AMR contraction, all indicative of abnormal coordination of cytokinesis and polarity establishment; null mutant displays an increased frequency of spontaneous mitochondrial genome loss; null mutant has increased chitin deposition, decreased endocytosis and decreased peroxisomal protein transport; overexpression results in decreased filamentation and invasive growth in the presence of short-chain alcohols and increased invasive growth in nitrogen-sufficient medium
","Regulator of Cdc42p and Rho1p; regulates AMR closure through Hof1p; inhibits Cdc42-dependent Cla4 activation at the division site, to prevent budding in the old bud neck; recruits Nis1p and Nba1p to the division site with Nap1 and the Rax1p-Rax2p dependent inheritance of Nis1p and Nba1p to bud scars to prevent division site repolarization; keeps Rho1p at the division site after AMR contraction to control secondary septum formation; relocalizes from bud neck to cytoplasm upon replication stress"
ALA1,S000005862,YOR335C,ALA1,ALAnyl-tRNA synthetase,"Essential gene; conditional mutants are impaired in cell cycle progression at elevated temperatures; reduced function mutants show decreased competitive fitness and have shortened telomeres; heterozygous diploid nulls are sensitive to zinc chloride and to oxidative stress; overexpression slows vegetative growth in S288C, increases invasive growth in Sigma1278b
",Cytoplasmic and mitochondrial alanyl-tRNA synthetase; required for protein synthesis; point mutation (cdc64-1 allele) causes cell cycle arrest at G1; lethality of null mutation is functionally complemented by human homolog AARS; mutations in human homolog AARS are associated with autoimmune disease polymyositis/dermatomyositis
ALG1,S000000314,YBR110W,ALG1,Asparagine-Linked Glycosylation,"Essential gene; conditional mutants are senstive to heat and impaired in invertase glycosylation; reduced function mutants show increased competitive fitness, increased sensitivity to DNA-damaging agent methyl methanesulfonate (MMS); heterozygous diploid nulls are sensitive to starvation
",Mannosyltransferase; involved in asparagine-linked glycosylation in the endoplasmic reticulum (ER); essential for viability; human homolog ALG1 complements yeast null mutant
ALG13,S000003015,YGL047W,ALG13,Asparagine-Linked Glycosylation,"Essential gene; reduced function mutants show decreased competitive fitness, increased sensitivity to rapamycin and to DNA-damaging agents methyl methanesulfonate (MMS) and hydroxyurea (HU); heterozygous diploid nulls have small cells
",Catalytic component of UDP-GlcNAc transferase; required for the second step of dolichyl-linked oligosaccharide synthesis; anchored to the ER membrane via interaction with Alg14p; similar to bacterial and human glycosyltransferases; protein abundance increases in response to DNA replication stress; both human homologs ALG13 and ALG14 are required to complement yeast alg13 mutant
ALG14,S000000274,YBR070C,ALG14,Asparagine Linked Glycosylation,"Essential gene; conditional mutants are sensitive to heat; reduced function mutants show increased competitive fitness, increased sensitivity to DNA-damaging agent methyl methanesulfonate (MMS) and to heat; repression increases chromosome rearrangements and chromosome loss
",Component of UDP-GlcNAc transferase; required for second step of dolichyl-linked oligosaccharide synthesis; anchors catalytic subunit Alg13p to ER membrane; similar to bacterial and human glycosyltransferases; both human homologs ALG13 and ALG14 are required to complement yeast alg14 mutant
ALG2,S000003033,YGL065C,ALG2,Asparagine-Linked Glycosylation,"Essential gene; mutations cause sensitivity to gentamycin, hygromycin B, kanamycin and neomycin B; repression leads to increased sensitivity to MMS and myriocin; overexpression results in slow growth
","Mannosyltransferase in the N-linked glycosylation pathway; catalyzes two consecutive steps in the N-linked glycosylation pathway; alg2 mutants exhibit temperature-sensitive growth and abnormal accumulation of the lipid-linked oligosaccharide Man2GlcNAc2-PP-Dol; human ALG2 complements the temperature sensitivity and dolichol-linked oligosaccharide biosynthesis defect of the alg2-1 mutant, but mutant form from a patient with CDG-Ii fails to complement"
ALG7,S000000447,YBR243C,ALG7,Asparagine-Linked Glycosylation,"Essential gene; activation blocks sporulation, increases resistance to GlcNAc phosphotransferase (GPT) inhibitor tunicamycin; reduced function mutants show decreased competitive fitness, decreased resistance to tunicamycin; repression causes loss of the mitochondrial genome, and decreased accumulation of dolichol-linked oligosaccharides; heterozygous diploid nulls are sensitive to tunicamycin
",UDP-N-acetyl-glucosamine-1-P transferase; transfers Glc-Nac-P from UDP-GlcNac to Dol-P in the ER in the first step of the dolichol pathway of protein asparagine-linked glycosylation; inhibited by tunicamycin; human homolog DPAGT1 can complement yeast ALG7 mutant
ALR1,S000005490,YOL130W,ALR1,ALuminum Resistance,"Null mutants grow very slowly; reduced function mutants show decreased competitive fitness, increased sensitivity to microtubule-destabilizing agent benomyl; overexpression slows growth, increases sensitivity to rapamycin
",Plasma membrane Mg(2+) transporter; expression and turnover are regulated by Mg(2+) concentration; overexpression confers increased tolerance to Al(3+) and Ga(3+) ions; magnesium transport defect of the null mutant is functionally complemented by either of the human genes MAGT1 and TUSC3 that are not orthologous to ALR1
AME1,S000000415,YBR211C,AME1,Associated with Microtubules and Essential,"Essential gene; conditional mutant is heat sensitive, arresting in anaphase at the restrictive temperature, and displays reduced vegetative growth at permissive temperatures; conditional, repressible and heterozygous null mutants display chromosomal instability, including elevated chromosome loss and chromosomal rearrangements; overexpression results in the accumulation of large-budded cells with 2C DNA content, indicative of a G2 or M phase delay or arrest
","Essential kinetochore protein associated with microtubules and SPBs; component of the kinetochore sub-complex COMA (Ctf19p, Okp1p, Mcm21p, Ame1p); involved in spindle checkpoint maintenance; orthologous to human centromere constitutive-associated network (CCAN) subunit CENP-U and fission yeast Mis17; relative distribution to the nucleus increases upon DNA replication stress"
AOS1,S000006384,YPR180W,AOS1,Activation Of Smt3p,"Essential gene; repression leads to opi- phenotype (overproduction and excretion of inositol in the absence of inositol and choline)
","Subunit of heterodimeric nuclear SUMO activating enzyme E1 with Uba2p; activates Smt3p (SUMO) before its conjugation to proteins (sumoylation), which may play a role in protein targeting; essential for viability; relocalizes to the cytosol in response to hypoxia"
APC1,S000005116,YNL172W,APC1,Anaphase Promoting Complex subunit,"Essential gene; reduction of function increases competitive fitness
","Largest subunit of the Anaphase-Promoting Complex/Cyclosome; APC/C is a ubiquitin-protein ligase required for degradation of anaphase inhibitors, including mitotic cyclins, during the metaphase/anaphase transition; component of the platform domain of the APC/C, based on structural analysis; localizes to nuclear foci that become diffuse upon DNA replication stress"
APC11,S000002166,YDL008W,APC11,Anaphase Promoting Complex,"Essential gene; conditional (ts) mutants show cell cycle arrest at G2/M phase transition, abnormal spindle morphology, chromosome instability and sensitivity to hydroxyurea
","Catalytic core subunit, Anaphase-Promoting Complex/Cyclosome (APC/C); which is a ubiquitin-protein ligase required for degradation of anaphase inhibitors, including mitotic cyclins, during the metaphase/anaphase transition; contains a RING-H2 domain that is required for activity"
APC2,S000004117,YLR127C,APC2,Anaphase Promoting Complex,"Essential gene; reduction of function decreases competitive fitness; haploproficient but heterozygous diploid is sensitive to starvation
","Subunit of the Anaphase-Promoting Complex/Cyclosome (APC/C); which is a ubiquitin-protein ligase required for degradation of anaphase inhibitors, including mitotic cyclins, during the metaphase/anaphase transition; component of the catalytic core of the APC/C; has similarity to cullin Cdc53p"
APC4,S000002525,YDR118W,APC4,Anaphase Promoting Complex,"Essential gene; conditional (ts) mutant shows chromosome instability; reduction of function leads to reduced telomere length and increased competitive fitness
","Subunit of the Anaphase-Promoting Complex/Cyclosome (APC/C); APC/C is a ubiquitin-protein ligase required for degradation of anaphase inhibitors, including mitotic cyclins, during the metaphase/anaphase transition; component of the platform domain of the APC/C, based on structural analysis; relative distribution to the nucleus increases upon DNA replication stress"
