LIB_ID,SGD_DB_ID,SYS_ID,GENE_SYM,NAME,PHENOTYPE,DESCRIPTION
SFI1,S000003926,YLL003W,SFI1,Suppressor of Fermentation Induced loss of stress resistance,,Centrin (Cdc31p)-binding protein required for SPB duplication; localizes to the half-bridge of the spindle pole body (SPB); required for progression through G(2)-M transition; phosphorylated by Cdc28p-Clb2p and by Cdc5p; dephosphorylated by Cdc14p; has similarity to Xenopus laevis XCAP-C
SFT1,S000002101,YKL006C-A,SFT1,Suppressor of sed Five Ts,,Intra-Golgi v-SNARE; required for transport of proteins between an early and a later Golgi compartment
SGD1,S000004328,YLR336C,SGD1,Suppressor of Glycerol Defect,,Essential nuclear protein; required for biogenesis of the small ribosomal subunit; has a possible role in the osmoregulatory glycerol response; putative homolog of human NOM1 which is implicated in acute myeloid leukemia
SGT1,S000005583,YOR057W,SGT1,Suppressor of G2 (Two) allele of skp1,"Essential gene; ts mutations cause G1 arrest and chromosome missegregation at the restrictive temperature; mutations cause sensitivity to benomyl and stabilization of Sic1p; in large-scale studies, repression causes decreased competitive fitness; diploid heterozygous null mutant is sensitive to geldanamycin and radicicol
",Cochaperone protein; regulates activity of adenylyl cyclase Cyr1p; involved in kinetochore complex assembly; associates with the SCF (Skp1p/Cdc53p/F box protein) ubiquitin ligase complex; acts as a linker between Skp1p and HSP90 complexes; protein abundance increases in response to DNA replication stress
SGV1,S000006365,YPR161C,SGV1,Suppressor of Gpa1-Val50 mutation,,Cyclin (Bur2p)-dependent protein kinase; part of the BUR kinase complex which functions in transcriptional regulation; phosphorylates the carboxy-terminal domain (CTD) of Rpo21p and the C-terminal repeat domain of Spt5p; recruits Spt6p to the CTD at the onset of transcription; regulated by Cak1p; similar to metazoan CDK9 proteins
SHE9,S000002801,YDR393W,SHE9,Sensitivity to High Expression,,Protein required for normal mitochondrial morphology; mitochondrial inner membrane protein; may be involved in fission of the inner membrane; forms a homo-oligomeric complex
SHQ1,S000001366,YIL104C,SHQ1,Small nucleolar RNAs of the box H/ACA family Quantitative accumulation,"Essential gene; repression causes accumulation of 35 S pre-rRNA and an aberrant 23S rRNA processing intermediate, with reduced levels of 18S rRA and box H/ACA snoRNAs; in large-scale studies, repression confers reduced competitive fitness; mutation causes resistance to cycloheximide; overexpression in a diploid strain of the Sigma1278b background causes enhanced pseudohyphal growth
",Chaperone protein; required for the assembly of box H/ACA snoRNPs and thus for pre-rRNA processing; functions as an RNA mimic; forms a complex with Naf1p and interacts with H/ACA snoRNP components Nhp2p and Cbf5p; homology with known Hsp90p cochaperones; relocalizes to the cytosol in response to hypoxia
SHR3,S000002371,YDL212W,SHR3,Super high Histidine Resistant,,Endoplasmic reticulum packaging chaperone; required for incorporation of amino acid permeases into COPII coated vesicles for transport to the cell surface
SHY1,S000003344,YGR112W,SHY1,SURF Homolog of Yeast,,Mitochondrial inner membrane protein required for complex IV assembly; associates with complex IV assembly intermediates and complex III/complex IV supercomplexes; similar to human SURF1 involved in Leigh Syndrome; complex IV is also known as cytochrome c oxidase
SIS1,S000004952,YNL007C,SIS1,SIt4 Suppressor,"Essential gene; null mutant is viable but slow growing under anaerobic conditions; repressible mutant displays elevated [SWI+] and [PSI1+] prion curing, and overexpression increases [SWI+] curing but decreases prion loss during heat stress; repressible mutant has an Opi- phenotype, overproducing and excreting inositol in the absence of inositol and choline
",Type II HSP40 co-chaperone that interacts with the HSP70 protein Ssa1p; shuttles between cytosol and nucleus; mediates delivery of misfolded proteins into the nucleus for degradation; involved in proteasomal degradation of misfolded cytosolic proteins; protein abundance increases in response to DNA replication stress; polyQ aggregates sequester Sis1p and interfere with clearance of misfolded proteins; similar to bacterial DnaJ proteins and mammalian DnaJB1
SKI6,S000003427,YGR195W,SKI6,SuperKIller,"Essential gene; ts mutants display delayed exit from stationary phase and sensitivity to benomyl and hygromycin B; mutant cells are enlarged, with large drooping buds that have elongated necks; repression or conditional mutations cause lowered levels of mature 5.8S rRNA and higher levels of many different RNA processing intermediates; in large-scale studies, repression causes chromosomal instability; mutations confer sensitivity to Calcofluor White and resistance to cycloheximide; diploid heterozygous null mutant is haploinsufficient and sensitive to starvation
",Exosome non-catalytic core component; involved in 3'-5' RNA processing and degradation in both the nucleus and the cytoplasm; has similarity to E. coli RNase PH and to human hRrp41p (EXOSC4)
SKP1,S000002736,YDR328C,SKP1,Suppressor of Kinetochore Protein mutant,,"Evolutionarily conserved kinetochore protein; part of multiple protein complexes, including the SCF ubiquitin ligase complex, the CBF3 complex that binds centromeric DNA, and the RAVE complex that regulates assembly of the V-ATPase; protein abundance increases in response to DNA replication stress"
SLD2,S000001591,YKL108W,SLD2,Synthetically Lethal with Dpb11-1,,"Single-stranded DNA origin-binding and annealing protein; required for initiation of DNA replication; phosphorylated in S phase by cyclin-dependent kinases (Cdks), promoting origin binding, DNA replication and Dpb11p complex formation; component of the preloading complex; binds the Mcm2-7p complex to prevent inappropriate Mcm2-7p interaction with the GINS complex in G1; required for S phase checkpoint; relative distribution to the nucleus increases upon DNA replication stress"
SLD3,S000003081,YGL113W,SLD3,Synthetically Lethal with Dpb11-1,,Protein involved in the initiation of DNA replication; required for proper assembly of replication proteins at the origins of replication; interacts with Cdc45p; localizes to nuclear foci that become diffuse upon DNA replication stress; homologous to the human Treslin/Ticrr protein
SLD5,S000002897,YDR489W,SLD5,Synthetic Lethality with Dpb11-1,,"Subunit of the GINS complex (Sld5p, Psf1p, Psf2p, Psf3p); complex is localized to DNA replication origins and implicated in assembly of the DNA replication machinery"
SLD7,S000005586,YOR060C,SLD7,Synthetic Lethality with Dpb11-24,,"Protein with a role in chromosomal DNA replication; interacts with Sld3p and reduces its affinity for Cdc45p; deletion mutant has aberrant mitochondria; ortholog of human MTBP, which is a DNA replication origin firing factor"
SLM3,S000002191,YDL033C,SLM3,Synthetic Lethal with Mss4,"Non-essential gene; null mutant displays slow respiratory growth and fails to 2-thiouridylate certain mitochondrial tRNAs; in large-scale studies, null mutant shows reduced competitive fitness in several different media; diploid homozygous null mutant requires myo-inositol and is sensitive to heat; diploid heterozygous null mutant is sensitive to starvation; null mutant displays altered resistance to various chemicals
","tRNA-specific 2-thiouridylase; responsible for 2-thiolation of the wobble base of mitochondrial tRNAs; human homolog TRMU is implicated in myoclonus epilepsy associated with ragged red fibers (MERRF), and can complement yeast null mutant"
SLM5,S000000618,YCR024C,SLM5,Synthetic Lethal with Mss4,,Mitochondrial asparaginyl-tRNA synthetase
SLN1,S000001409,YIL147C,SLN1,Synthetic Lethal of N-end rule,,"Transmembrane histidine phosphotransfer kinase and osmosensor; regulates MAP kinase cascade; transmembrane protein with an intracellular kinase domain that signals to Ypd1p and Ssk1p, thereby forming a phosphorelay system similar to bacterial two-component regulators"
SLS1,S000004129,YLR139C,SLS1,Synthetic Lethal with SSM4,,Mitochondrial membrane protein; coordinates expression of mitochondrially-encoded genes; may facilitate delivery of mRNA to membrane-bound translation machinery
SLU7,S000002495,YDR088C,SLU7,Synergistic Lethal with U5 snRNA,"Essential gene; conditional mutant displays heat- and cold-sensitivity, and accumulates an abnormal splicing intermediate at permissive temperature; in a large-scale study, the diploid heterozygous null mutant is sensitive to a human cationic antimicrobial peptide derivative
",RNA splicing factor; required for ATP-independent portion of 2nd catalytic step of spliceosomal RNA splicing; interacts with Prp18p; contains zinc knuckle domain
SLY1,S000002597,YDR189W,SLY1,Suppressor of Loss of Ypt1,,Hydrophilic protein involved in ER/Golgi vesicle trafficking; SM (Sec1/Munc-18) family protein that binds the tSNARE Sed5p and stimulates its assembly into a trans-SNARE membrane-protein complex
SMC1,S000001886,YFL008W,SMC1,Stability of MiniChromosomes,,"Subunit of the multiprotein cohesin complex; essential protein involved in chromosome segregation and in double-strand DNA break repair; SMC chromosomal ATPase family member, binds DNA with a preference for DNA with secondary structure"
SMC2,S000001927,YFR031C,SMC2,Structural Maintenance of Chromosomes,,"Subunit of the condensin complex; condensin reorganizes chromosomes during both mitosis and meiosis; essential SMC chromosomal ATPase family member that forms a subcomplex with Smc2p that has ATP-hydrolyzing and DNA-binding activity, but other condensin subunits are required for chromatin binding; required for clustering of tRNA genes at the nucleolus"
SMC3,S000003610,YJL074C,SMC3,Stability of MiniChromosomes,"Essential gene; mutation of acetylation site(s) results in defective cohesion establishment, increased sister chromatid separation and/or inviability; conditional mutant has increased colony sectoring due to chromosomal instability; conditional homozygous diploid mutant has decreased reciprocal recombination and is unable to sporulate; repressible mutant accumulates cells with a 1C DNA content indicative of a G1 arrest or delay
","Subunit of the multiprotein cohesin complex; required for sister chromatid cohesion in mitotic cells; also required, with Rec8p, for cohesion and recombination during meiosis; phylogenetically conserved SMC chromosomal ATPase family member"
SMC4,S000004076,YLR086W,SMC4,Structural Maintenance of Chromosomes,,"Subunit of the condensin complex; condensin reorganizes chromosomes during both mitosis and meiosis; forms a subcomplex with Smc2p that has ATP-hydrolyzing and DNA-binding activity, but other condensin subunits are required for chromatin binding; required for tRNA gene clustering at the nucleolus; potential Cdc28p substrate"
SMC5,S000005394,YOL034W,SMC5,Structural Maintenance of Chromosomes,,Subunit of the SMC5-SMC6 complex; the SMC5-SMC6 complex plays a key role in the removal of X-shaped DNA structures that arise between sister chromatids during DNA replication and repair; binds single-stranded DNA and has ATPase activity; supports nucleolar function; S. pombe homolog forms a heterodimer with S. pombe Rad18p that is involved in DNA repair
SMD1,S000003306,YGR074W,SMD1,snRNA Sm binding site protein D1,"Essential gene; conditional mutant displays heat- and cold-sensitivity; in large-scale studies, repression confers decreased competitive fitness, and the diploid heterozygous null mutant is haploproficient
","Core Sm protein Sm D1; part of heteroheptameric complex (with Smb1p, Smd2p, Smd3p, Sme1p, Smx3p, and Smx2p) that is part of the spliceosomal U1, U2, U4, and U5 snRNPs; relocalizes to the cytosol in response to hypoxia; homolog of human Sm D1; protein abundance increases in response to DNA replication stress"
SMD2,S000004265,YLR275W,SMD2,,"Essential gene; in large-scale studies, the diploid heterozygous null mutant shows decreased competitive fitness and haploinsufficiency
","Core Sm protein Sm D2; part of heteroheptameric complex (with Smb1p, Smd1p, Smd3p, Sme1p, Smx3p, and Smx2p) that is part of the spliceosomal U1, U2, U4, and U5 snRNPs; homolog of human Sm D2"
SMD3,S000004137,YLR147C,SMD3,,,"Core Sm protein Sm D3; part of heteroheptameric complex (with Smb1p, Smd1p, Smd2p, Sme1p, Smx3p, and Smx2p) that is part of the spliceosomal U1, U2, U4, and U5 snRNPs; homolog of human Sm D3"
SME1,S000005685,YOR159C,SME1,Sm protein E,"Essential gene; in large-scale studies, repression confers decreased competitive fitness and sensitivity to benomyl
","Core Sm protein Sm E; part of heteroheptameric complex (with Smb1p, Smd1p, Smd2p, Smd3p, Smx3p, and Smx2p) that is part of the spliceosomal U1, U2, U4, and U5 snRNPs; homolog of human Sm E"
SMI1,S000003461,YGR229C,SMI1,Suppressor of MAR Inhibitor,,Protein involved in the regulation of cell wall synthesis; proposed to be involved in coordinating cell cycle progression with cell wall integrity
SMP3,S000005675,YOR149C,SMP3,Stable Maintenance of pSRI,"Essential gene; in large-scale studies, repression confers decreased competitive fitness and sensitivity to human TDP-43 protein; conditional mutant displays chromosome instability at semi-permissive temperature and accumulates less Rnr3p at the permissive temperature in the presence of MMS; diploid heterozygous null mutant is sensitive to hydrogen peroxide
","Alpha 1,2-mannosyltransferase; involved in glycosyl phosphatidyl inositol (GPI) biosynthesis; required for addition of the fourth, side branching mannose to the GPI core structure"
SMT3,S000002918,YDR510W,SMT3,Suppressor of Mif Two,"Essential gene; reduction-of-function mutations cause increased telomere length, sensitivity to MMS, and decreased competitive fitness; overexpression results in slow growth, increased glucose consumption and ethanol accumulation
","Ubiquitin-like protein of the SUMO family; conjugated to lysine residues of target proteins; associates with transcriptionally active genes; regulates chromatid cohesion, chromosome segregation, APC-mediated proteolysis, DNA replication and septin ring dynamics; human homolog SUMO1 can complement yeast null mutant"
SMX2,S000002965,YFL017W-A,SMX2,,,"Core Sm protein Sm G; part of heteroheptameric complex (with Smb1p, Smd1p, Smd2p, Smd3p, Sme1p, and Smx3p) that is part of the spliceosomal U1, U2, U4, and U5 snRNPs; homolog of human Sm G"
SMX3,S000006386,YPR182W,SMX3,,"Essential gene; in a large-scale study, diploid heterozygous null mutant is haploproficient
","Core Sm protein Sm F; part of heteroheptameric complex (with Smb1p, Smd1p, Smd2p, Smd3p, Sme1p, and Smx2p) that is part of the spliceosomal U1, U2, U4, and U5 snRNPs; homolog of human Sm F"
SNF1,S000002885,YDR477W,SNF1,Sucrose NonFermenting,"Non-essential gene; mutants are defective in glucose-dependent regulation of transcription, with pleiotropic effects on carbon source utilization, respiratory growth, cell wall structure, thermotolerance, hyperosmotic stress and starvation sensitivity, autophagy, peroxisome biogenesis, filamentous growth, sporulation in diploids
","AMP-activated S/T protein kinase; complexes with Snf4p and a Sip1p/Sip2p/Gal83p family member; required for glucose-repressed gene transcription, heat shock, sporulation, and peroxisome biogenesis; active form involved in mitotic spindle alignment in non-limiting glucose; regulates Hxk2p nucleocytoplasmic shuttling; regulates filamentous growth and acts as a non-canonical GEF-activating Arf3p during invasive growth; sumoylation inhibits Snf1p, targeting it for Ub-ligase mediated destruction"
SNF2,S000005816,YOR290C,SNF2,Sucrose NonFermenting,"Non-essential gene; mutants show defects in chromatin remodeling and transcriptional regulation, leading to inability to switch mating type, abnormal utilization of carbon sources, increased sensitivity to DNA-affecting factors (UV, gamma rays, camptothecin, cisplatin, hydroxyurea) and cell wall-affecting drugs (Congo Red); null mutation in homozygous diploid decreases respiratory growth, prevents sporulation, and increases innate thermotolerance
",Catalytic subunit of the SWI/SNF chromatin remodeling complex; involved in transcriptional regulation; contains DNA-stimulated ATPase activity; functions interdependently in transcriptional activation with Snf5p and Snf6p
SNF4,S000003083,YGL115W,SNF4,Sucrose NonFermenting,,"Activating gamma subunit of the AMP-activated Snf1p kinase complex; additional subunits of the complex are Snf1p and a Sip1p/Sip2p/Gal83p family member; activates glucose-repressed genes, represses glucose-induced genes; role in sporulation, and peroxisome biogenesis; protein abundance increases in response to DNA replication stress"
SNF5,S000000493,YBR289W,SNF5,Sucrose NonFermenting,,Subunit of the SWI/SNF chromatin remodeling complex; involved in transcriptional regulation; functions interdependently in transcriptional activation with Snf2p and Snf6p; relocates to the cytosol under hypoxic conditions
SNF6,S000001017,YHL025W,SNF6,Sucrose NonFermenting,,Subunit of the SWI/SNF chromatin remodeling complex; involved in transcriptional regulation; functions interdependently in transcriptional activation with Snf2p and Snf5p; relocates to the cytosol under hypoxic conditions
SNF7,S000004015,YLR025W,SNF7,Sucrose NonFermenting,,One of four subunits of the ESCRT-III complex; involved in the sorting of transmembrane proteins into the multivesicular body (MVB) pathway; recruited from the cytoplasm to endosomal membranes; ESCRT-III stands for endosomal sorting complex required for transport III
SNF8,S000005923,YPL002C,SNF8,Sucrose NonFermenting,,Component of the ESCRT-II complex; ESCRT-II is involved in ubiquitin-dependent sorting of proteins into the endosome; appears to be functionally related to SNF7; involved in glucose derepression
SNM1,S000002886,YDR478W,SNM1,Suppressor of Nuclear Mitochondrial endoribonuclease,,Ribonuclease MRP complex subunit; ribonuclease (RNase) MRP cleaves pre-rRNA and has a role in cell cycle-regulated degradation of daughter cell-specific mRNAs; binds to the NME1 RNA subunit of RNase MRP
SNP1,S000001323,YIL061C,SNP1,,,Component of U1 snRNP required for mRNA splicing via spliceosome; substrate of the arginine methyltransferase Hmt1p; may interact with poly(A) polymerase to regulate polyadenylation; homolog of human U1 70K protein; protein abundance increases in response to DNA replication stress
SNU114,S000001656,YKL173W,SNU114,Small NUclear ribonucleoprotein associated,,GTPase component of U5 snRNP involved in mRNA splicing via spliceosome; binds directly to U5 snRNA; proposed to be involved in conformational changes of the spliceosome; similarity to ribosomal translocation factor EF-2
SNU13,S000000752,YEL026W,SNU13,Small NUclear ribonucleoprotein associated,"Essential gene; repression causes mis-localization of box C/D snoRNAs to the nucleoplasm rather than the nucleolar body; in large-scale studies, conditional mutants display chromosome instability, sensitivity to K28 killer toxin, and reduced levels of Rnr3p; diploid heterozygous null mutant is sensitive to heat shock, oxidative stress, and verrucarin A; mutant is resistant to cycloheximide
","RNA binding protein; part of U3 snoRNP involved in rRNA processing, part of U4/U6-U5 tri-snRNP involved in mRNA splicing, similar to human 15.5K protein"
SNU23,S000002256,YDL098C,SNU23,Small NUclear ribonucleoprotein associated,,Component of the U4/U6.U5 snRNP complex; involved in mRNA splicing via spliceosome
SNU56,S000002648,YDR240C,SNU56,Small NUclear ribonucleoprotein associated,,"Component of U1 snRNP required for mRNA splicing via spliceosome; yeast specific, no metazoan counterpart; interacts with mRNA in commitment complex"
SNU71,S000003245,YGR013W,SNU71,Small NUclear ribonucleoprotein associated,,"Component of U1 snRNP required for mRNA splicing via spliceosome; yeast specific, no metazoan counterpart"
SOD2,S000001050,YHR008C,SOD2,SuperOxide Dismutase,"Non-essential gene; null mutant displays a respiratory growth defect, increased apoptosis, and decreased chronological and replicative lifespan, null mutant is sensitive to a variety of environmental stresses including oxidative stress, desiccation, heat, ionic stress, and a variety of chemicals; in large-scale studies the null mutant displays reduced competitive fitness and altered resistance to a variety of chemicals
",Mitochondrial manganese superoxide dismutase; protects cells against oxygen toxicity and oxidative stress; human mitochondrial SOD2 can complement a yeast null mutant and human cytoplasmic SOD1 can also complement when targeted to the mitochondrial matrix
SOF1,S000003934,YLL011W,SOF1,Suppressor Of Fibrillarin,,Protein required for biogenesis of 40S (small) ribosomal subunit; has similarity to the beta subunit of trimeric G-proteins and the splicing factor Prp4p; essential gene
SOG2,S000005880,YOR353C,SOG2,,,Key component of the RAM signaling network; required for proper cell morphogenesis and cell separation after mitosis
SOM1,S000002954,YEL059C-A,SOM1,SOrting Mitochondrial,,Subunit of the mitochondrial inner membrane peptidase (IMP); IMP is required for maturation of mitochondrial proteins of the intermembrane space; Som1p facilitates cleavage of a subset of substrates; contains twin cysteine-x9-cysteine motifs
SOV1,S000004670,YMR066W,SOV1,Synthesis Of Var,,Mitochondrial protein of unknown function
SPB1,S000000559,YCL054W,SPB1,Suppressor of PaB1 mutant,,"AdoMet-dependent methyltransferase; involved in rRNA processing and 60S ribosomal subunit maturation; methylates G2922 in the tRNA docking site of the large subunit rRNA and in the absence of snR52, U2921; suppressor of PAB1 mutants"
SPB4,S000001894,YFL002C,SPB4,Suppressor of PAB1,,Putative ATP-dependent RNA helicase; nucleolar protein required for synthesis of 60S ribosomal subunits at a late step in the pathway; sediments with 66S pre-ribosomes in sucrose gradients
SPC105,S000003061,YGL093W,SPC105,Spindle Pole Component,,Subunit of a kinetochore-microtubule binding complex; complex bridges centromeric heterochromatin and kinetochore MAPs and motors; required for sister chromatid bi-orientation and kinetochore binding of SAC components; complex also includes Kre28p; modified by sumoylation
SPC110,S000002764,YDR356W,SPC110,Spindle Pole Component,,"Inner plaque spindle pole body (SPB) component; ortholog of human kendrin; gamma-tubulin small complex (gamma-TuSC) receptor that interacts with Spc98p to recruit the complex to the nuclear side of the SPB, connecting nuclear microtubules to the SPB; promotes gamma-TuSC assembly and oligomerization to initiate microtubule nucleation; interacts with Tub4p-complex and calmodulin; phosphorylated by Mps1p in cell cycle-dependent manner"
SPC19,S000002609,YDR201W,SPC19,Spindle Pole Component,,Essential subunit of the Dam1 complex (aka DASH complex); complex couples kinetochores to the force produced by MT depolymerization thereby aiding in chromosome segregation; also localized to nuclear side of spindle pole body
SPC24,S000004723,YMR117C,SPC24,Spindle Pole Component,,"Component of the kinetochore-associated Ndc80 complex; involved in chromosome segregation, spindle checkpoint activity, and kinetochore clustering; evolutionarily conserved; other members include Ndc80p, Nuf2p, Spc24p, and Spc25p"
SPC25,S000000820,YER018C,SPC25,Spindle Pole Component,,"Component of the kinetochore-associated Ndc80 complex; involved in chromosome segregation, spindle checkpoint activity, and kinetochore clustering; evolutionarily conserved; other members include Ndc80p, Nuf2p, Spc24p, and Spc25p"
SPC29,S000006045,YPL124W,SPC29,Spindle Pole Component,,Inner plaque spindle pole body (SPB) component; links the central plaque component Spc42p to the inner plaque component Spc110p; required for SPB duplication
SPC3,S000004056,YLR066W,SPC3,Signal Peptidase Complex,,"Subunit of signal peptidase complex; complex catalyzes cleavage of N-terminal signal sequences of proteins targeted to the secretory pathway; homologous to mammalian SPC22/23; other members of the complex are Spc1p, Spc2p, and Sec11p"
SPC34,S000001745,YKR037C,SPC34,Spindle Pole Component,,Essential subunit of the Dam1 complex (aka DASH complex); complex couples kinetochores to the force produced by MT depolymerization thereby aiding in chromosome segregation; also localized to nuclear side of spindle pole body
SPC42,S000001525,YKL042W,SPC42,Spindle Pole Component,,"Central plaque component of spindle pole body (SPB); involved in SPB duplication, may facilitate attachment of the SPB to the nuclear membrane"
SPC97,S000001215,YHR172W,SPC97,Spindle Pole Component,,Component of the microtubule-nucleating Tub4p (gamma-tubulin) complex; interacts with Spc110p at the spindle pole body (SPB) inner plaque and with Spc72p at the SPB outer plaque
SPC98,S000005070,YNL126W,SPC98,Spindle Pole Component,,Component of the microtubule-nucleating Tub4p (gamma-tubulin) complex; interacts with Spc110p at the spindle pole body (SPB) inner plaque and with Spc72p at the SPB outer plaque
SPN1,S000006337,YPR133C,SPN1,Suppresses Postrecruitment functions gene Number 1,,"Protein involved in RNA polymerase II transcription; is constitutively recruited to the CYC1 promoter and is required for recruitment of chromatin remodeling factors for the expression of CYC1 gene; interacts genetically or physically with RNAP II, TBP, TFIIS, and chromatin remodelling factors; central domain highly conserved throughout eukaryotes; mutations confer an Spt- phenotype"
