LIB_ID,SGD_DB_ID,SYS_ID,GENE_SYM,NAME,PHENOTYPE,DESCRIPTION
NAM2,S000004374,YLR382C,NAM2,Nuclear Accommodation of Mitochondria,"Non-essential gene; null mutant is incapable of respiration and shows petite phenotype, decreased endocytosis and biofilm formation, sensitivity to oxidative stress, hygromycin B, spermine, and decreased ability to utilize ammonium as a nitrogen source
","Mitochondrial leucyl-tRNA synthetase; also has direct role in splicing of several mitochondrial group I introns; indirectly required for mitochondrial genome maintenance; human homolog LARS2 can complement yeast null mutant, and is implicated in Perrault syndrome"
NAM9,S000005081,YNL137C,NAM9,Nuclear Accommodation of Mitochondria,,Mitochondrial ribosomal component of the small subunit
NAN1,S000006047,YPL126W,NAN1,Net1 Associated Nuclear protein,,U3 snoRNP protein; component of the small (ribosomal) subunit (SSU) processosome containing U3 snoRNA; required for the biogenesis of18S rRNA
NAR1,S000005184,YNL240C,NAR1,Nuclear Architecture Related,,Subunit of the cytosolic iron-sulfur (FeS) protein assembly machinery; required for maturation of cytosolic and nuclear FeS proteins and for normal resistance to oxidative stress; deficiency results in shortened lifespan and sensitivity to paraquat; homologous to human Narf
NAT2,S000003379,YGR147C,NAT2,N-terminal AcetylTransferase,,Protein of unknown function; has an apparent role in acetylation of N-terminal methionine residues
NBP1,S000004449,YLR457C,NBP1,Nap1 Binding Protein,,"Spindle pole body (SPB) component; required for the insertion of the duplication plaque into the nuclear membrane during SPB duplication; essential for bipolar spindle formation; component of the Mps2p-Bbp1p complex; NBP1 has a paralog, YPR174C, that arose from the whole genome duplication"
NBP2,S000002569,YDR162C,NBP2,Nap1 Binding Protein,,Protein involved in the HOG (high osmolarity glycerol) pathway; negatively regulates Hog1p by recruitment of phosphatase Ptc1p to the Pbs2p-Hog1p complex; interacts with Bck1p and down regulates the cell wall integrity pathway; found in the nucleus and cytoplasm; contains an SH3 domain and a Ptc1p binding domain (PBM)
NBP35,S000003059,YGL091C,NBP35,Nucleotide Binding Protein,,Essential cytoplasmic iron-sulfur cluster binding protein; forms a complex with Cfd1p that is involved in iron-sulfur protein assembly in the cytosol; similar to P-loop NTPases
NCB2,S000002805,YDR397C,NCB2,Negative Cofactor B,"Essential gene; reduction of function leads to slow growth; overexpression causes cell cycle arrest or delay at G1 phase
",Subunit of a heterodimeric NC2 transcription regulator complex; complex binds to TBP and can repress transcription by preventing preinitiation complex assembly or stimulate activated transcription; homologous to human NC2beta; complex also includes Bur6p
NCP1,S000001084,YHR042W,NCP1,NADP-Cytochrome P450 reductase,,NADP-cytochrome P450 reductase; involved in ergosterol biosynthesis; associated and coordinately regulated with Erg11p
NDC1,S000004493,YML031W,NDC1,Nuclear Division Cycle,,"Subunit of the transmembrane ring of the nuclear pore complex (NPC); contributes to nucleocytoplasmic transport, NPC biogenesis and spindle pole body duplication; homologous to human NDC1"
NDC80,S000001406,YIL144W,NDC80,Nuclear Division Cycle,"Essential gene; reduction of function leads to slow growth, abnormal spindle morphology and cell cycle progression, increased chromosome loss, and sensitivity to benomyl, hydroxyurea; overexpression causes increased cell size and abnormal nuclear morphology
","Component of the kinetochore-associated Ndc80 complex; conserved coiled-coil protein involved in chromosome segregation, spindle checkpoint activity, and kinetochore assembly and clustering; evolutionarily conserved; complex members include Ndc80p, Nuf2p, Scp24p, and Spc25p; modified by sumoylation"
NDD1,S000005899,YOR372C,NDD1,Nuclear Division Defective,,Transcriptional activator essential for nuclear division; localized to the nucleus; essential component of the mechanism that activates the expression of a set of late-S-phase-specific genes; turnover is tightly regulated during cell cycle and in response to DNA damage
NDI1,S000004589,YML120C,NDI1,NADH Dehydrogenase Internal,"Non-essential gene; null mutation results in decreased apoptosis, replicative lifespan and respiratory growth; overexpression causes increased accumulation of reactive oxygen species
","NADH:ubiquinone oxidoreductase; transfers electrons from NADH to ubiquinone in respiratory chain but does not pump protons, in contrast to higher eukaryotic multisubunit respiratory complex I; upon apoptotic stress, is activated in mitochondria by N-terminal cleavage, then translocates to cytoplasm to induce apoptosis; homolog of human AIFM2; yeast NDI1 complements several phenotypes of human cell line with mutated MT-ND4, implicated in Leber hereditary optic neuropathy"
NEO1,S000001310,YIL048W,NEO1,NEOmycin-resistance,,"Phospholipid translocase (flippase), role in phospholipid asymmetry of plasma membrane; involved in endocytosis, vacuolar biogenesis and Golgi to ER vesicle-mediated transport; localizes to endosomes and the Golgi apparatus"
NET1,S000003612,YJL076W,NET1,Nucleolar silencing Establishing factor and Telophase regulator,,"Core subunit of the RENT complex; involved in nucleolar silencing and telophase exit; stimulates transcription by RNA polymerase I and regulates nucleolar structure; NET1 has a paralog, TOF2, that arose from the whole genome duplication"
NFS1,S000000522,YCL017C,NFS1,NiFS-like,,Cysteine desulfurase; involved in iron-sulfur cluster (Fe/S) biogenesis and in thio-modification of mitochondrial and cytoplasmic tRNAs; essential protein located predominantly in mitochondria
NFU1,S000001523,YKL040C,NFU1,NifU-like protein,,"Protein involved in Fe-S cluster transfer to mitochondrial clients; protects [4Fe-4S] clusters from damage due to oxidative stress; acts along with Bol3 at a late step in the transfer of [4Fe-4S] clusters from the ISA complex to client proteins; Fe-S loaded homodimer at steady state; similar to NifU, a bacterial protein required for Fe/S cluster maturation; ortholog of the human NFU1, mutations of which are associated with Multiple Mitochondria Dysfunctions Syndrome (MMDS1)"
NGG1,S000002583,YDR176W,NGG1,,"Non-essential gene; null mutants grow slowly, have shortened lifespan, decreased fitness and ethanol tolerance, abnormal morphology of vacuoles and buds, are sensitive to preservatives, antibiotics, heat, osmotic stress, dessication; homozygous diploid nulls cannot sporulate; overexpression affects chromatin silencing
","Subunit of chromatin modifying histone acetyltransferase complexes; member of the ADA complex, the SAGA complex, and the SLIK complex; transcriptional regulator involved in glucose repression of Gal4p-regulated genes"
NGL2,S000004898,YMR285C,NGL2,,,"Protein involved in 5.8S rRNA processing; Ccr4p-like RNase required for correct 3'-end formation of 5.8S rRNA at site E; similar to Ngl1p; NGL2 has a paralog, NGL3, that arose from the whole genome duplication"
NHP2,S000002367,YDL208W,NHP2,Non-Histone Protein,"Essential gene; repressible mutations lead to slow growth and decreased processing of pre-rRNA; reduction-of-function mutations cause increased telomere length
","Protein related to mammalian high mobility group (HMG) proteins; nuclear protein; essential for function of H/ACA-type snoRNPs, which are involved in 18S rRNA processing"
NHX1,S000002864,YDR456W,NHX1,Na+/H+ eXchanger,"Non-essential gene; null mutant is sensitive to hyperosmotic stress and has abnormal vacuoles, also shows decreased growth rate and sensitivity to multiple drugs, including hygromycin B, actinomycin D, bleomycin, doxorubicin, and other chemicals (MMS, hydroxyurea, flucytosine, spermine)
","Na+/H+ and K+/H+ exchanger; required for intracellular sequestration of Na+ and K+; located in the vacuole and late endosome compartments; required for osmotolerance to acute hypertonic shock and for vacuolar fusion; ortholog of human NHE9, which is linked to autism"
NIC96,S000001898,YFR002W,NIC96,Nucleoporin-Interacting Component of 96 kDa,,"Linker nucleoporin component of the nuclear pore complex (NPC); also part of the NPC nuclear basket; contributes to nucleocytoplasmic transport and NPC biogenesis; forms stable associations with three FG-nucleoporins (Nsp1p, Nup57p, and Nup49p)"
NIP1,S000004926,YMR309C,NIP1,Nuclear ImPort,,eIF3c subunit of the eukaryotic translation initiation factor 3 (eIF3); involved in the assembly of preinitiation complex and start codon selection; eIF3 is also involved in programmed stop codon readthrough
NIP100,S000006095,YPL174C,NIP100,Nuclear ImPort,,Large subunit of the dynactin complex; dynactin is involved in partitioning the mitotic spindle between mother and daughter cells; putative ortholog of mammalian p150(glued)
NIP7,S000006132,YPL211W,NIP7,Nuclear ImPort,"Essential gene; depletion leads to abnormal mitochondrial morphology; conditional (ts) mutant is sensitive to paromomycin and accumulates abnormal polysomes (halfmers)
",Nucleolar protein required for 60S ribosome subunit biogenesis; constituent of 66S pre-ribosomal particles; physically interacts with Nop8p and the exosome subunit Rrp43p
NMD3,S000001213,YHR170W,NMD3,Nonsense-Mediated mRNA Decay,"Essential gene; conditional (ts) mutants fail to export 60S ribosomal subunits from the nucleus; haploinsufficient, null mutation in heterozygous diploid causes growth defects, chromosome instability, and sensitivity to starvation
",Protein involved in nuclear export of the large ribosomal subunit; acts as a Crm1p-dependent adapter protein for export of nascent ribosomal subunits through the nuclear pore complex
NMT1,S000004185,YLR195C,NMT1,N-Myristoyl Transferase,,"N-myristoyl transferase; catalyzes the cotranslational, covalent attachment of myristic acid to the N-terminal glycine residue of several proteins involved in cellular growth and signal transduction"
NNF1,S000003873,YJR112W,NNF1,Necessary for Nuclear Function,,"Essential component of the outer kinetochore MIND complex; joins kinetochore subunits contacting DNA to those contacting microtubules; required for kinetochore bi-orientation and accurate chromosome segregation; complex consists of Mtw1p, Nnf1p, Nsl1p and Dsn1p; homologous to metazoan CENP-H proteins"
NOB1,S000005582,YOR056C,NOB1,Nin1 (One) Binding protein,,"Protein involved in proteasomal and 40S ribosomal subunit biogenesis; required for cleavage of the 20S pre-rRNA to generate the mature 18S rRNA; cleavage is activated by Fun12p, a GTPase and translation initiation factor; relocalizes from nucleus to nucleolus upon DNA replication stress"
NOC2,S000005732,YOR206W,NOC2,NucleOlar Complex associated,,Protein involved in ribosome biogenesis; forms a nucleolar complex with Mak21p that binds to 90S and 66S pre-ribosomes; forms a nuclear complex with Noc3p that binds to 66S pre-ribosomes; both complexes mediate intranuclear transport of ribosomal precursors; acts as part of a Mak21p-Noc2p-Rrp5p module that associates with nascent pre-rRNA during transcription and has a role in bigenesis of the large ribosomal subunit
NOC3,S000003992,YLR002C,NOC3,NucleOlar Complex associated,,"Subunit of a nuclear complex with Noc2p and pre-replicative complexes; the Noc2p-Noc3p complex binds to 66S ribosomal precursors to mediate their maturation and intranuclear transport; binds to chromatin at active replication origins, and is required for pre-RC formation and maintenance during DNA replication licensing"
NOC4,S000006348,YPR144C,NOC4,NucleOlar Complex associated,,Nucleolar protein; forms a complex with Nop14p that mediates maturation and nuclear export of 40S ribosomal subunits; relocalizes to the cytosol in response to hypoxia
NOG1,S000006014,YPL093W,NOG1,NucleOlar G-protein,"Essential gene; several point mutations cause slow growth; haploinsufficient, null mutation in heterozygous diploid results in decreased cell size, slow growth and starvation sensitivity
",Putative GTPase; associates with free 60S ribosomal subunits in the nucleolus and is required for 60S ribosomal subunit biogenesis; constituent of 66S pre-ribosomal particles; member of the ODN family of nucleolar G-proteins
NOG2,S000005336,YNR053C,NOG2,NucleOlar G-protein,"Essential gene in S288C; depletion results in slow growth; in Sigma1278b null mutation causes defects in filamentous growth
","Putative GTPase; associates with pre-60S ribosomal subunits in the nucleolus and is required for their nuclear export and maturation; recruited by ribosomal proteins L17, L35, and L37 to assembling ribosomes after 27SB pre-rRNA is generated, immediately preceding removal of ITS2"
NOP1,S000002172,YDL014W,NOP1,NucleOlar Protein,"Essential gene; repression leads to reduced levels of pre-rRNA species, increased accumulation of snRNAs and defects in small ribosomal subunits biogenesis; overexpression causes G1 phase delay and slow growth
","Histone glutamine methyltransferase, modifies H2A at Q105 in nucleolus; component of the small subunit processome complex, which is required for processing of pre-18S rRNA; ortholog of mammalian fibrillarin; inviability of the null mutant is functionally complemented by human FBL"
NOP10,S000007455,YHR072W-A,NOP10,NucleOlar Protein,"Essential gene; repression leads to increased chromosome instability
",Subunit of box H/ACA snoRNP complex; required for pseudouridylation and processing of pre-18S rRNA
NOP14,S000002307,YDL148C,NOP14,NucleOlar Protein,,"Nucleolar protein; forms a complex with Noc4p that mediates maturation and nuclear export of 40S ribosomal subunits; also present in the small subunit processome complex, which is required for processing of pre-18S rRNA"
NOP15,S000005054,YNL110C,NOP15,NucleOlar Protein,,Constituent of 66S pre-ribosomal particles; involved in 60S ribosomal subunit biogenesis; localizes to both nucleolus and cytoplasm
NOP19,S000003483,YGR251W,NOP19,NucleOlar Protein,,"Ribosome biogenesis factor; nucleolar protein associated with pre-rRNA components of the 90S preribosome, required for cleavage of pre-rRNA at A0, A1 and A2 sites; interacts with RNA helicase Dhr2p and RNA helicase-like protein Utp25p; required for incorporation of Utp25p into preribosomes"
NOP2,S000005005,YNL061W,NOP2,NucleOlar Protein,"Essential gene; reduction of function results in defects in pre-rRNA processing that leads to decreased production of mature rRNA and 60S ribosomal subunits
","rRNA m5C methyltransferase; methylates cytosine at position 2870 of 25S rRNA; has an essential function independent of rRNA methylation; contains seven beta-strand methyltransferase motif; essential for processing and maturation of 27S pre-rRNA and large ribosomal subunit biogenesis; localized to the nucleolus; constituent of 66S pre-ribosomal particles; rRNA methylation defect and lethality are functionally complemented by human NOP2, a gene upregulated in cancer"
NOP4,S000005964,YPL043W,NOP4,NucleOlar Protein,"Essential gene; reduction of function decreases starvation resistance and competitive fitness; haploinsufficient, heterozygous null mutation in diploids causes starvation sensitivity and increased sensitivity to 5-fluorouracil, flucytosine
",Nucleolar protein; essential for processing and maturation of 27S pre-rRNA and large ribosomal subunit biogenesis; constituent of 66S pre-ribosomal particles; contains four RNA recognition motifs (RRMs)
NOP53,S000006067,YPL146C,NOP53,NucleOlar Protein,,Nucleolar protein; involved in biogenesis of the 60S subunit of the ribosome; interacts with rRNA processing factors Cbf5p and Nop2p and with the nucleolar proteins Nop17p and Nip7p; null mutant is viable but growth is severely impaired
NOP56,S000004187,YLR197W,NOP56,NucleOlar Protein of 56.8 kDa,,Essential evolutionarily-conserved nucleolar protein; component of the box C/D snoRNP complexes that direct 2'-O-methylation of pre-rRNA during its maturation; overexpression causes spindle orientation defects
NOP58,S000005837,YOR310C,NOP58,NucleOlar Protein of 58 kDa,,"Protein involved in producing mature rRNAs and snoRNAs; involved in pre-rRNA processing, 18S rRNA synthesis, and snoRNA synthesis; component of the small subunit processome complex, which is required for processing of pre-18S rRNA"
NOP7,S000003335,YGR103W,NOP7,NucleOlar Protein,,Component of several different pre-ribosomal particles; forms a complex with Ytm1p and Erb1p that is required for maturation of the large ribosomal subunit; required for exit from G<sub>0</sub> and the initiation of cell proliferation
NOP8,S000005504,YOL144W,NOP8,NucleOlar Protein,,Nucleolar protein required for 60S ribosomal subunit biogenesis
NPA3,S000003833,YJR072C,NPA3,Nucleolar Preribosomal Associated,,Member of the conserved GPN-loop GTPase family; has a role in transport of RNA polymerase II to the nucleus; exhibits GTP-dependent binding to PolII; has ATPase activity; involved in sister chromatid cohesion; phosphorylated by the Pcl1p-Pho85p kinase complex; human homolog XAB1 interacts with human RNA polymerase II; protein abundance increases in response to DNA replication stress
NPL6,S000004697,YMR091C,NPL6,Nuclear Protein Localization,,"Component of the RSC chromatin remodeling complex; interacts with Rsc3p, Rsc30p, Ldb7p, and Htl1p to form a module important for a broad range of RSC functions"
NRD1,S000005195,YNL251C,NRD1,Nuclear pre-mRNA Down-regulation,"Essential gene; reduction of function results in accumulation of abnormally processed mRNA, rRNA, snRNA precursors; mutants show small cell size and slow growth; overexpression increases invasive growth in Sigma1278b
","RNA-binding subunit of Nrd1 complex; complex interacts with exosome to mediate 3'-end formation of some mRNAs, snRNAs, snoRNAs, and CUTs; interacts with CTD of RNA pol II large subunit Rpo21p at phosphorylated Ser5 to direct transcription termination of non-polyadenylated transcripts; H3K4 trimethylation of transcribed regions by Set1p enhances recruitment of Nrd1p to those sites; role in regulation of mitochondrial abundance and cell size"
NSA1,S000003079,YGL111W,NSA1,Nop Seven Associated,,Constituent of 66S pre-ribosomal particles; involved in 60S ribosomal subunit biogenesis
NSA2,S000000928,YER126C,NSA2,Nop Seven Associated,,"Protein constituent of 66S pre-ribosomal particles; contributes to processing of the 27S pre-rRNA; recruited by ribosomal proteins L17, L35, and L37 to assembling ribosomes after 27SB pre-rRNA is generated, immediately preceding removal of ITS2"
NSE1,S000003997,YLR007W,NSE1,Non-SMC Element,,Component of the SMC5-SMC6 complex; this complex plays a key role in the removal of X-shaped DNA structures that arise between sister chromatids during DNA replication and repair
NSE3,S000002696,YDR288W,NSE3,Non SMC Element,,Component of the SMC5-SMC6 complex; this complex plays a key role in the removal of X-shaped DNA structures that arise between sister chromatids during DNA replication and repair; protein abundance increases in response to DNA replication stress
NSE4,S000002263,YDL105W,NSE4,Non-SMC Element,,Component of the SMC5-SMC6 complex; this complex plays a key role in the removal of X-shaped DNA structures that arise between sister chromatids during DNA replication and repair
NSE5,S000004485,YML023C,NSE5,Non-SMC Element 5,,Component of the SMC5-SMC6 complex; this complex plays a key role in the removal of X-shaped DNA structures that arise between sister chromatids during DNA replication and repair
NSL1,S000006154,YPL233W,NSL1,Nnf1 Synthetic Lethal,,Essential component of the MIND kinetochore complex; joins kinetochore subunits contacting DNA to those contacting microtubules; required for accurate chromosome segregation; complex consists of Mtw1p Including Nnf1p-Nsl1p-Dsn1p (MIND)
NSP1,S000003577,YJL041W,NSP1,NucleoSkeletal-like Protein,,"FG-nucleoporin component of central core of the nuclear pore complex; also part of the nuclear pore complex (NPC) nuclear basket; contributes directly to nucleocytoplasmic transport and maintenance of the NPC permeability barrier; found in stable complex with Nup82p, Gle2p and two other FG-nucleoporins (Nup159p and Nup116p); also found in stable complex with Nic96p and two other FG-nucleoproteins (Nup49p and Nup57p)"
NTF2,S000000811,YER009W,NTF2,Nuclear Transport Factor,"Essential gene; conditional (ts) mutations cause defects in nuclear import and slow growth
",Nuclear envelope protein; interacts with GDP-bound Gsp1p and with proteins of the nuclear pore to transport Gsp1p into the nucleus where it is an essential player in nucleocytoplasmic transport
NTR2,S000001730,YKR022C,NTR2,NineTeen complex Related protein,,"Essential protein that forms a dimer with Ntr1p; also forms a trimer, with Ntr2p and the DExD/H-box RNA helicase Prp43p, that is involved in spliceosome disassembly"
NUD1,S000005900,YOR373W,NUD1,,,"Mitotic exit network (MEN) scaffold protein; core component of the SPB outer plaque that functions in astral microtubule organization via Spc72p; scaffold for recruitment of MEN components, such as Cdc15p, Tem1p and the Bfa1p-Bub2p checkpoint complex; phosphorylation by Cdc15p creates a Dbf2p-Mob1p phospho-docking site enabling Cdc15p-dependent complex activation and mitotic exit; acts through the MEN to specify Kar9p-mediated asymmetric SPB inheritance; homologous to mammalian centriolin"
NUF2,S000005430,YOL069W,NUF2,NUclear Filament-containing protein,"Essential gene; depletion leads to increased frequency of chromosomal rearrangements and chromosome loss; overexpression also causes chromosome instability
","Component of the kinetochore-associated Ndc80 complex; involved in chromosome segregation, spindle checkpoint activity, and kinetochore clustering; evolutionarily conserved; other members include Ndc80p, Nuf2p, Spc24p, and Spc25p"
NUG1,S000000808,YER006W,NUG1,NUclear GTPase,,GTPase that associates with nuclear 60S pre-ribosomes; required for export of 60S ribosomal subunits from the nucleus
NUM1,S000002557,YDR150W,NUM1,NUclear Migration,,Protein required for nuclear migration; component of the mitochondria-ER-cortex-anchor (MECA); required for the association of mitochondria with the cell cortex and for accurate distribution of mitochondrial network; interacts with Mdm36p to link the ER and mitochondria at the cortex; localizes to the mother cell cortex and the bud tip; may mediate interactions of dynein and cytoplasmic microtubules with the cell cortex
NUP1,S000005624,YOR098C,NUP1,NUclear Pore,,FG-nucleoporin component of central core of the nuclear pore complex; contributes directly to nucleocytoplasmic transport and maintenance of thenuclear pore complex (NPC) permeability barrier; possible karyopherin release factor that accelerates release of karyopherin-cargo complexes after transport across NPC; both NUP1 and NUP60 are homologous to human NUP153
NUP116,S000004650,YMR047C,NUP116,NUclear Pore,,"FG-nucleoporin component of central core of the nuclear pore complex; contributes directly to nucleocytoplasmic transport and maintenance of the nuclear pore complex (NPC) permeability barrier; forms a stable association with Nup82p, Gle2p and two other FG-nucleoporins (Nsp1p and Nup159p); NUP116 has a paralog, NUP100, that arose from the whole genome duplication"
NUP145,S000003060,YGL092W,NUP145,NUclear Pore,,"Essential protein with distinct roles in two nuclear pore subcomplexes; catalyzes its own proteolytic cleavage in vivo to generate a C-terminal fragment that is a structural component of the Nup84p subcomplex (with roles in NPC biogenesis and localization of genes to the nuclear periphery), and an N-terminal fragment that is one of several FG-nucleoporins within the NPC central core directly responsible for nucleocytoplasmic transport; homologous to human NUP98"
NUP159,S000001377,YIL115C,NUP159,NUclear Pore,,"FG-nucleoporin component of central core of the nuclear pore complex; also part of the nuclear pore complex (NPC) cytoplasmic filaments; contributes directly to nucleocytoplasmic transport; regulates ADP release from the ATP-dependent RNA helicase Dbp5p; forms a stable association with Nup82p, Gle2p and two other FG-nucleoporins (Nsp1p and Nup116p)"
NUP192,S000003576,YJL039C,NUP192,NUclear Pore,,Essential subunit of inner ring of nuclear pore complex (NPC); plays a role in modulating transport through the NPC; homologous to human NUP205
NUP49,S000003140,YGL172W,NUP49,NUclear Pore,,FG-nucleoporin component of central core of the nuclear pore complex; contributes directly to nucleocytoplasmic transport and maintenance of the nuclear pore complex (NPC) permeability barrier; found in stable complex with Nic96p and two other FG-nucleoproteins (Nsp1p and Nup57p)
NUP57,S000003351,YGR119C,NUP57,NUclear Pore,,FG-nucleoporin component of central core of the nuclear pore complex; contributes directly to nucleocytoplasmic transport and maintenance of the nuclear pore complex (NPC) permeability barrier; found in stable complex with Nic96p and two other FG-nucleoproteins (Nsp1p and Nup49p)
NUP82,S000003597,YJL061W,NUP82,NUclear Pore,,"Linker nucleoporin component of the nuclear pore complex (NPC); also part of the NPC cytoplasmic filaments; contributes to nucleocytoplasmic transport and NPC biogenesis; forms stable associations with three FG-nucleoporins (Nsp1p, Nup159p, and Nup116p); relocalizes to the cytosol in response to hypoxia"
NUP85,S000003803,YJR042W,NUP85,NUclear Pore,,"Subunit of the Nup84p subcomplex of the nuclear pore complex (NPC); contributes to nucleocytoplasmic transport and NPC biogenesis and is involved in establishment of a normal nucleocytoplasmic concentration gradient of the GTPase Gsp1p; also plays roles in several processes that may require localization of genes or chromosomes at the nuclear periphery, including double-strand break repair, transcription and chromatin silencing; homologous to human NUP85 aka NUP75"
